{"schemaVersion":"1.1.0","producer":{"name":"upstream-elk-java-phase-oracle","sourceCommit":"28e5173243cab0cf4e2c9816c803bc0d5c47ab24","harnessRevision":"1.3.0","license":"EPL-2.0"},"fixture":{"caseId":"chain_4","manifestVersion":"1.0.0","inputDigest":"sha256:61ddd66ec9dd0f75f1bd5c7dc17fe103fc4fe757fcdd8d5d0b3c78ef28d218b1"},"run":{"seed":1,"options":{"algorithm":"org.eclipse.elk.layered","direction":"RIGHT","edgeRouting":"ORTHOGONAL","cycleBreaking":"GREEDY","layering":"NETWORK_SIMPLEX","crossingMinimization":"LAYER_SWEEP","nodePlacement":"BRANDES_KOEPF","portConstraints":"FIXED_ORDER","randomSeed":1},"resolvedOptions":{"org.eclipse.elk.algorithm":null,"org.eclipse.elk.alignment":"AUTOMATIC","org.eclipse.elk.animTimeFactor":100,"org.eclipse.elk.animate":true,"org.eclipse.elk.aspectRatio":1.600000023841858,"org.eclipse.elk.bendPoints":null,"org.eclipse.elk.box.packingMode":"SIMPLE","org.eclipse.elk.childAreaHeight":null,"org.eclipse.elk.childAreaWidth":null,"org.eclipse.elk.commentBox":false,"org.eclipse.elk.contentAlignment":["H_LEFT","V_TOP"],"org.eclipse.elk.debugMode":false,"org.eclipse.elk.direction":"RIGHT","org.eclipse.elk.edge.thickness":1.0,"org.eclipse.elk.edge.type":"NONE","org.eclipse.elk.edgeLabels.inline":false,"org.eclipse.elk.edgeLabels.placement":"CENTER","org.eclipse.elk.edgeRouting":"ORTHOGONAL","org.eclipse.elk.expandNodes":false,"org.eclipse.elk.font.name":null,"org.eclipse.elk.font.size":null,"org.eclipse.elk.hierarchyHandling":"INHERIT","org.eclipse.elk.hypernode":false,"org.eclipse.elk.insideSelfLoops.activate":false,"org.eclipse.elk.insideSelfLoops.yo":false,"org.eclipse.elk.interactive":false,"org.eclipse.elk.interactiveLayout":false,"org.eclipse.elk.json.edgeCoords":"INHERIT","org.eclipse.elk.json.shapeCoords":"INHERIT","org.eclipse.elk.junctionPoints":[],"org.eclipse.elk.labelManager":null,"org.eclipse.elk.layered.allowNonFlowPortsToSwitchSides":false,"org.eclipse.elk.layered.compaction.connectedComponents":false,"org.eclipse.elk.layered.compaction.postCompaction.constraints":"SCANLINE","org.eclipse.elk.layered.compaction.postCompaction.strategy":"NONE","org.eclipse.elk.layered.considerModelOrder.components":"NONE","org.eclipse.elk.layered.considerModelOrder.crossingCounterNodeInfluence":0.0,"org.eclipse.elk.layered.considerModelOrder.crossingCounterPortInfluence":0.0,"org.eclipse.elk.layered.considerModelOrder.longEdgeStrategy":"DUMMY_NODE_OVER","org.eclipse.elk.layered.considerModelOrder.noModelOrder":false,"org.eclipse.elk.layered.considerModelOrder.portModelOrder":false,"org.eclipse.elk.layered.considerModelOrder.strategy":"NONE","org.eclipse.elk.layered.crossingMinimization.forceNodeModelOrder":false,"org.eclipse.elk.layered.crossingMinimization.greedySwitch.activationThreshold":40,"org.eclipse.elk.layered.crossingMinimization.greedySwitch.type":"TWO_SIDED","org.eclipse.elk.layered.crossingMinimization.greedySwitchHierarchical.type":"OFF","org.eclipse.elk.layered.crossingMinimization.hierarchicalSweepiness":0.1,"org.eclipse.elk.layered.crossingMinimization.inLayerPredOf":null,"org.eclipse.elk.layered.crossingMinimization.inLayerSuccOf":null,"org.eclipse.elk.layered.crossingMinimization.positionChoiceConstraint":null,"org.eclipse.elk.layered.crossingMinimization.positionId":-1,"org.eclipse.elk.layered.crossingMinimization.semiInteractive":false,"org.eclipse.elk.layered.crossingMinimization.strategy":"LAYER_SWEEP","org.eclipse.elk.layered.cycleBreaking.strategy":"GREEDY","org.eclipse.elk.layered.directionCongruency":"READING_DIRECTION","org.eclipse.elk.layered.edgeLabels.centerLabelPlacementStrategy":"MEDIAN_LAYER","org.eclipse.elk.layered.edgeLabels.sideSelection":"SMART_DOWN","org.eclipse.elk.layered.edgeRouting.polyline.slopedEdgeZoneWidth":2.0,"org.eclipse.elk.layered.edgeRouting.selfLoopDistribution":"NORTH","org.eclipse.elk.layered.edgeRouting.selfLoopOrdering":"STACKED","org.eclipse.elk.layered.edgeRouting.splines.mode":"SLOPPY","org.eclipse.elk.layered.edgeRouting.splines.sloppy.layerSpacingFactor":0.2,"org.eclipse.elk.layered.feedbackEdges":false,"org.eclipse.elk.layered.generatePositionAndLayerIds":false,"org.eclipse.elk.layered.highDegreeNodes.threshold":16,"org.eclipse.elk.layered.highDegreeNodes.treatment":false,"org.eclipse.elk.layered.highDegreeNodes.treeHeight":5,"org.eclipse.elk.layered.interactiveReferencePoint":"CENTER","org.eclipse.elk.layered.layerUnzipping.layerSplit":2,"org.eclipse.elk.layered.layerUnzipping.resetOnLongEdges":true,"org.eclipse.elk.layered.layerUnzipping.strategy":"NONE","org.eclipse.elk.layered.layering.coffmanGraham.layerBound":2147483647,"org.eclipse.elk.layered.layering.layerChoiceConstraint":null,"org.eclipse.elk.layered.layering.layerConstraint":"NONE","org.eclipse.elk.layered.layering.layerId":-1,"org.eclipse.elk.layered.layering.minWidth.upperBoundOnWidth":4,"org.eclipse.elk.layered.layering.minWidth.upperLayerEstimationScalingFactor":2,"org.eclipse.elk.layered.layering.nodePromotion.maxIterations":0,"org.eclipse.elk.layered.layering.nodePromotion.strategy":"NONE","org.eclipse.elk.layered.layering.strategy":"NETWORK_SIMPLEX","org.eclipse.elk.layered.mergeEdges":false,"org.eclipse.elk.layered.mergeHierarchyEdges":true,"org.eclipse.elk.layered.nodePlacement.bk.edgeStraightening":"IMPROVE_STRAIGHTNESS","org.eclipse.elk.layered.nodePlacement.bk.fixedAlignment":"NONE","org.eclipse.elk.layered.nodePlacement.favorStraightEdges":true,"org.eclipse.elk.layered.nodePlacement.linearSegments.deflectionDampening":0.3,"org.eclipse.elk.layered.nodePlacement.networkSimplex.nodeFlexibility":null,"org.eclipse.elk.layered.nodePlacement.networkSimplex.nodeFlexibility.default":"NONE","org.eclipse.elk.layered.nodePlacement.strategy":"BRANDES_KOEPF","org.eclipse.elk.layered.portSortingStrategy":"INPUT_ORDER","org.eclipse.elk.layered.priority.direction":0,"org.eclipse.elk.layered.priority.shortness":0,"org.eclipse.elk.layered.priority.straightness":0,"org.eclipse.elk.layered.spacing.baseValue":null,"org.eclipse.elk.layered.spacing.edgeEdgeBetweenLayers":10.0,"org.eclipse.elk.layered.spacing.edgeNodeBetweenLayers":10.0,"org.eclipse.elk.layered.spacing.nodeNodeBetweenLayers":20.0,"org.eclipse.elk.layered.thoroughness":7,"org.eclipse.elk.layered.unnecessaryBendpoints":false,"org.eclipse.elk.layered.wrapping.additionalEdgeSpacing":10.0,"org.eclipse.elk.layered.wrapping.correctionFactor":1.0,"org.eclipse.elk.layered.wrapping.cutting.cuts":null,"org.eclipse.elk.layered.wrapping.cutting.msd.freedom":1,"org.eclipse.elk.layered.wrapping.cutting.strategy":"MSD","org.eclipse.elk.layered.wrapping.multiEdge.distancePenalty":2.0,"org.eclipse.elk.layered.wrapping.multiEdge.improveCuts":true,"org.eclipse.elk.layered.wrapping.multiEdge.improveWrappedEdges":true,"org.eclipse.elk.layered.wrapping.strategy":"OFF","org.eclipse.elk.layered.wrapping.validify.forbiddenIndices":null,"org.eclipse.elk.layered.wrapping.validify.strategy":"GREEDY","org.eclipse.elk.layoutAncestors":false,"org.eclipse.elk.margins":"[top=0.0,left=0.0,bottom=0.0,right=0.0]","org.eclipse.elk.maxAnimTime":4000,"org.eclipse.elk.minAnimTime":400,"org.eclipse.elk.noLayout":false,"org.eclipse.elk.nodeLabels.padding":"[top=5.0,left=5.0,bottom=5.0,right=5.0]","org.eclipse.elk.nodeLabels.placement":[],"org.eclipse.elk.nodeSize.constraints":[],"org.eclipse.elk.nodeSize.fixedGraphSize":false,"org.eclipse.elk.nodeSize.minimum":"(0.0,0.0)","org.eclipse.elk.nodeSize.options":["DEFAULT_MINIMUM_SIZE"],"org.eclipse.elk.omitNodeMicroLayout":false,"org.eclipse.elk.padding":"[top=12.0,left=12.0,bottom=12.0,right=12.0]","org.eclipse.elk.partitioning.activate":false,"org.eclipse.elk.partitioning.partition":null,"org.eclipse.elk.port.anchor":null,"org.eclipse.elk.port.borderOffset":0.0,"org.eclipse.elk.port.index":null,"org.eclipse.elk.port.side":"UNDEFINED","org.eclipse.elk.portAlignment.default":"JUSTIFIED","org.eclipse.elk.portAlignment.east":null,"org.eclipse.elk.portAlignment.north":null,"org.eclipse.elk.portAlignment.south":null,"org.eclipse.elk.portAlignment.west":null,"org.eclipse.elk.portConstraints":"UNDEFINED","org.eclipse.elk.portLabels.nextToPortIfPossible":false,"org.eclipse.elk.portLabels.placement":["OUTSIDE"],"org.eclipse.elk.portLabels.treatAsGroup":true,"org.eclipse.elk.position":null,"org.eclipse.elk.priority":0,"org.eclipse.elk.progressBar":false,"org.eclipse.elk.randomSeed":1,"org.eclipse.elk.resolvedAlgorithm":null,"org.eclipse.elk.scaleFactor":1.0,"org.eclipse.elk.separateConnectedComponents":true,"org.eclipse.elk.softwrappingFuzziness":0.0,"org.eclipse.elk.spacing.commentComment":10.0,"org.eclipse.elk.spacing.commentNode":10.0,"org.eclipse.elk.spacing.componentComponent":20.0,"org.eclipse.elk.spacing.edgeEdge":10.0,"org.eclipse.elk.spacing.edgeLabel":2.0,"org.eclipse.elk.spacing.edgeNode":10.0,"org.eclipse.elk.spacing.individual":null,"org.eclipse.elk.spacing.labelLabel":0.0,"org.eclipse.elk.spacing.labelNode":5.0,"org.eclipse.elk.spacing.labelPortHorizontal":1.0,"org.eclipse.elk.spacing.labelPortVertical":1.0,"org.eclipse.elk.spacing.nodeNode":20.0,"org.eclipse.elk.spacing.nodeSelfLoop":10.0,"org.eclipse.elk.spacing.portPort":10.0,"org.eclipse.elk.spacing.portsSurrounding":"[top=0.0,left=0.0,bottom=0.0,right=0.0]","org.eclipse.elk.topdown.hierarchicalNodeAspectRatio":1.414,"org.eclipse.elk.topdown.hierarchicalNodeWidth":150.0,"org.eclipse.elk.topdown.nodeType":"HIERARCHICAL_NODE","org.eclipse.elk.topdown.scaleCap":1.0,"org.eclipse.elk.topdown.scaleFactor":1.0,"org.eclipse.elk.topdown.sizeApproximator":null,"org.eclipse.elk.topdown.sizeCategories":3,"org.eclipse.elk.topdown.sizeCategoriesHierarchicalNodeWeight":4,"org.eclipse.elk.topdownLayout":false,"org.eclipse.elk.validateGraph":false,"org.eclipse.elk.validateOptions":true,"org.eclipse.elk.zoomToFit":false}},"snapshots":[{"ordinal":0,"boundary":"imported","processor":{"slot":null,"className":null,"event":"milestone"},"components":[{"id":"component-0","layers":[],"layerlessNodeIds":["a","b","c","d"],"nodes":[{"id":"a","kind":"normal","layer":null,"orde